{
  "$schema": "https://json-schema.org/draft/2020-12/schema",
  "$id": "https://invarianceresearch.xyz/schemas/strategy_spec_v1.schema.json",
  "title": "Strategy Spec V1",
  "type": "object",
  "additionalProperties": true,
  "required": [
    "schema_version",
    "strategy_spec_id",
    "hypothesis_id",
    "strategy_family",
    "universe",
    "timeframe",
    "required_datasets",
    "signals",
    "parameters",
    "cost_model",
    "slippage_model",
    "risk_model",
    "execution_semantics",
    "compiler"
  ],
  "properties": {
    "schema_version": { "const": "strategy_spec_v1" },
    "strategy_spec_id": { "type": "string", "minLength": 3 },
    "hypothesis_id": { "type": "string", "minLength": 3 },
    "strategy_family": {
      "enum": ["trend_continuation", "mean_reversion", "breakout", "volatility_filter", "funding_liquidation_context"]
    },
    "universe": { "type": "array", "items": { "type": "string" }, "minItems": 1 },
    "timeframe": { "type": "string" },
    "required_datasets": { "type": "array", "items": { "type": "string" }, "minItems": 1 },
    "signals": {
      "type": "array",
      "minItems": 1,
      "items": {
        "type": "object",
        "required": ["name", "function", "fields"],
        "properties": {
          "name": { "type": "string" },
          "function": { "type": "string" },
          "fields": { "type": "array", "items": { "type": "string" } }
        }
      }
    },
    "parameters": {
      "type": "object",
      "additionalProperties": {
        "type": "object",
        "required": ["min", "max", "default"],
        "properties": {
          "min": { "type": "number" },
          "max": { "type": "number" },
          "default": { "type": "number" }
        }
      }
    },
    "cost_model": { "type": "object" },
    "slippage_model": { "type": "object" },
    "risk_model": { "type": "object" },
    "execution_semantics": { "type": "object" },
    "compiler": { "type": "object" }
  }
}
