{
  "schema_version": "strategy_spec_v1",
  "strategy_spec_id": "STRAT-REF-BREAKOUT-001",
  "hypothesis_id": "HYP-REF-BREAKOUT-001",
  "strategy_family": "breakout",
  "universe": ["BTCUSDT"],
  "timeframe": "15m",
  "required_datasets": ["ohlcv"],
  "signals": [
    { "name": "donchian_breakout", "function": "donchian_breakout", "fields": ["close", "high", "low"], "closed_bar_only": true },
    { "name": "time_stop", "function": "time_stop", "fields": ["close"], "max_bars_param": "max_hold_bars" }
  ],
  "parameters": {
    "lookback_bars": { "min": 12, "max": 96, "default": 48 },
    "max_hold_bars": { "min": 4, "max": 48, "default": 16 }
  },
  "cost_model": { "kind": "bps", "round_trip_bps": 8 },
  "slippage_model": { "kind": "bps", "round_trip_bps": 4 },
  "risk_model": { "kind": "fixed_fractional", "risk_per_trade_pct": 0.5, "no_pyramiding": true },
  "execution_semantics": {
    "lookahead_allowed": false,
    "interpolation_allowed": false,
    "signal_bar_policy": "closed_bar_only",
    "base_data_frequency_expected": "1m",
    "exit_monitoring_timeframe": "1m"
  },
  "compiler": { "target": "classic_engine_run_config", "safe_mode": "classic_with_optional_compiled_features", "assistant_assumptions": [] }
}
